{
  "id": "ed-campus-safety-vawa-2020-wave-02",
  "wave_id": "ed-campus-safety-vawa-2020-wave-02",
  "source_family": "ed_campus_safety_dataset",
  "generated_at": "2026-07-07",
  "rows": [],
  "reason_counts": {},
  "public_claim_limit": "Quarantine rows identify blocked import candidates. A quarantined row is not a public event record."
}
